{
  "$schema": "https://json-schema.org/draft/2020-12/schema",
  "$id": "https://tasleemat.pmo/schemas/completed/PMO-04.08.07.schema.json",
  "title": "Completed RISK MITIGATION ACTION PLAN Data Contract",
  "description": "Additive structural schema validating completed RISK MITIGATION ACTION PLAN artifact data payloads (PMO-04.08.07).",
  "type": "object",
  "properties": {
    "artifact_id": {
      "type": "string",
      "const": "PMO-04.08.07"
    },
    "metadata": {
      "type": "object",
      "properties": {
        "project_name": {
          "type": "string",
          "minLength": 1
        },
        "project_code": {
          "type": "string"
        },
        "date_prepared": {
          "type": "string",
          "format": "date"
        },
        "project_manager": {
          "type": "string",
          "minLength": 1
        },
        "prepared_by": {
          "type": "string",
          "minLength": 1
        },
        "version": {
          "type": "string"
        },
        "status": {
          "type": "string",
          "enum": [
            "draft",
            "baselined",
            "in_review",
            "approved"
          ]
        }
      },
      "required": [
        "project_name",
        "date_prepared",
        "project_manager",
        "prepared_by"
      ]
    },
    "risk_assessment": {
      "type": "object",
      "properties": {
        "risk_id_and_title": {
          "type": "string",
          "minLength": 1,
          "description": "The identifier and title of the risk exactly as the risk register carries them, so this plan can be joined back to the register. A title written here that differs from the register's is the defect that makes the two documents disagree about what is being planned for."
        },
        "current_risk_score": {
          "type": "string",
          "minLength": 1,
          "description": "The probability multiplied by the impact, each on the scale the register uses, with both factors shown rather than only the product. A score given on its own hides the reason for it, and a score whose factors cannot be read back cannot be recalculated when one of them changes."
        }
      },
      "required": [
        "risk_id_and_title",
        "current_risk_score"
      ]
    },
    "mitigation_plan": {
      "type": "object",
      "properties": {
        "mitigation_strategy": {
          "type": "string",
          "minLength": 1,
          "description": "Which of the four treatments the risk is given: avoid, transfer, mitigate, or accept. Accept is a decision that needs a reason, so an accepted risk carries the reason and the name of whoever accepted it."
        },
        "detailed_action_steps": {
          "type": "string",
          "minLength": 1,
          "description": "The plan as ordered steps, each with an owner and a date, so that the plan can be read as work rather than as intent. A step with no owner is a wish, and a step with no date is a step that never starts."
        },
        "resource_requirements": {
          "type": "string",
          "minLength": 1,
          "description": "What executing the plan costs and who has to be assigned to it: the budget, the people, and the time. Stated so the request can be approved against something, rather than argued in a meeting where no one can check it."
        },
        "target_risk_score": {
          "type": "string",
          "minLength": 1,
          "description": "The score the plan is expected to reach, with the assumptions it depends on. A target written without saying which steps deliver it cannot be checked afterwards, which leaves no way to know whether the plan worked."
        }
      },
      "required": [
        "mitigation_strategy",
        "detailed_action_steps",
        "resource_requirements",
        "target_risk_score"
      ]
    }
  },
  "required": [
    "artifact_id",
    "metadata",
    "risk_assessment",
    "mitigation_plan"
  ]
}